Opening,,Title,Director,Cast,Genre,
*JAN*,*16*,*Chandni Chowk to China*,Nikhil Advani,"Akshay Kumar, Deepika Padukone, Mithun Chakraborty, Ranvir Shorey",Action/ Comedy,
,*23*,*Aasma: The Sky Is the Limit*,Rohit Nayyar,"Hrishitaa Bhatt, Seema Biswas, Nauheed Cyrusi, Mansi Dovhal, Ravi Gossain",Drama film,
,,*Raaz – The Mystery Continues*,Mohit Suri,"Emraan Hashmi, Kangana Ranaut, Adhyayan Suman, Jackie Shroff",Horror film,
,*30*,*Luck by Chance*,Zoya Akhtar,"Farhan Akhtar, Konkona Sen Sharma, Hrithik Roshan, Juhi Chawla, Rishi Kapoor, 
Sanjay Kapoor, Dimple Kapadia, Isha Sharvani, Shah Rukh Khan",Drama film,
,,*Victory*,AjitPal Mangat,"Harman Baweja, Amrita Rao, Anupam Kher, Gulshan Grover",Sports film,
*FEB*,*6*,*Dev.D*,Anurag Kashyap,"Abhay Deol, Mahi Gill, Kalki Koechlin",Romance,
,,*Chal Chala Chal*,T. K. Rajeev Kumar,"Govinda, Rajpal Yadav, Reemma Sen, Om Puri",Comedy,
,,*Mere Khwabon Mein Jo Aaye*,Madhureeta Anand,"Arbaaz Khan, Randeep Hooda, Raima Sen","Drama, Fantasy, Musical",
,*13*,*Billu*,Priyadarshan,"Irrfan Khan, Shah Rukh Khan, Lara Dutta, Om Puri, Rajpal Yadav, Asrani",Drama film,
,,*The Stoneman Murders*,Manish Gupta,"Kay Kay Menon, Arbaaz Khan, Vikram Gokhale, Rukhsar","Crime, Drama, Mystery",
,*20*,*Delhi-6*,Rakeysh Omprakash Mehra,"Abhishek Bachchan, Sonam Kapoor, Amitabh Bachchan, Waheeda Rehman, Divya 
Dutta, Rishi Kapoor, Om Puri, Atul Kulkarni, Prem Chopra, Akshay Kumar",Romance Drama,
,*27*,*Kisse Pyaar Karoon*,Ajay Chandock,"Arshad Warsi, Aashish Chaudhary, Aarti Chhabria, Yash Tonk, Udita Goswami",Romance,
*MAR*,*6*,*13B*,Vikram K. Kumar,"Madhavan, Neetu Chandra, Saranya, Poonam Dhillon, Ravibabu, Sachin Khedekar, 
Deepak Dobriyal, Murli Sharma",Horror film,
,,*Dhoondte Reh Jaaoge*,Umesh Shukla,"Kunal Khemu, Paresh Rawal, Soha Ali Khan, Sonu Sood, Asrani, Johnny Lever",Comedy,
,,*Karma Aur Holi*,Manish Gupta,"Sushmita Sen, Randeep Hooda, Naomi Campbell, Suresh Oberoi, Suchitra 
Krishnamoorthi",Drama,
,*13*,*Jai Veeru*,Puneet Sira,"Fardeen Khan, Kunal Khemu, Dia Mirza, Anjana Sukhani",Action comedy,
,,*Little Zizou*,Sooni Taraporevala,"Boman Irani, John Abraham, Kurush Deboo",Comedy,
,,*Gulaal*,Anurag Kashyap,"Kay Kay Menon, Deepak Dobriyal, Piyush Mishra, Mahi Gill, Jesse Randhawa, Aditya 
Shrivastava",Drama,
,*20*,*Aloo Chaat*,Robby Grewal,"Aftab Shivdasani, Aamna Sharif, Linda Arsenio, Kulbhushan Kharbanda, Manoj 
Pahwa, Sanjay Mishra'",Romantic comedy,
,,*Barah Aana*,Raja Menon,"Naseeruddin Shah, Tannishtha Chatterjee",Drama,
,,*Firaaq*,Nandita Das,"Deepti Naval, Naseeruddin Shah, Paresh Rawal, Raghubir Yadav",Political,
,,*Lottery*,Hemant Prabhu,"Abhijeet Sawant, Sanjay Narvekar, Mukesh Tiwari, Rucha Gujarati, Manisha 
Kelkar",Comedy,
,,*Straight*,Parvati Balagopalan,"Daman Baggan, Anuj Chaudhary, Ketki Dave, Siddharth Makkar, Gul Panag, Vinay 
Pathak",Romantic comedy,
,*27*,*Aa Dekhen Zara*,Jehangir Surti,"Neil Mukesh, Bipasha Basu, Rahul Dev, Sophie Choudry",Action Thriller,
,,*99*,"Krishna DK, Raj Nidimoru","Vinod Khanna, Kunal Khemu, Soha Ali Khan, Boman Irani, Mahesh Manjrekar, 
Simone Singh",Comedy,
,,*Ek: The Power of One*,Sangeeth Sivan,"Bobby Deol, Shriya Saran, Nana Patekar, Chunky Pandey, Pradeep, Kulbhushan 
Kharbanda, Jackie Shroff",Action Thriller,
*APR*,*3*,*8 x 10 Tasveer*,Nagesh Kukunoor,"Akshay Kumar, Ayesha Takia, Sharmila Tagore, Javed Jaffrey",Action Thriller,
,*10*,*Ek Se Bure Do*,Tarique,"Arshad Warsi, Anita Hassanandani, Rajpal Yadav, Govind Namdeo, Yashpal 
Sharma, Virendra Saxena, Vijay Raaz and Razzak Khan",Comedy,
,,*Pal Pal Dil Ke Saath*,V Krishna Kumar,"Ajay Jadeja, Mahie Gill, Satish Shah, Sushma Seth, Vinod Kambli, Sylvie",Drama,
,,*Coffee House*,Gurbir Grewal,"Ashutosh Rana, Sakshi Tanwar, Harsh Chhaya",Drama,
,,*School Days*,Dilip Sood,"Pankaj Sharma, Rajiv Sethi, Virender Sharma, Shailly Sehgal",,
,,*Royal Utsav*,Ravi K. Patwa,"Vikram Kumar, Monalisa, Sudesh Berry, Master Abhishek Sharma, Tripta 
Chopra, Antra Vishwas, Charu Arora",Historical drama,
,*17*,*Chowrasta Crossroads of Love*,Anjan Dutt,"Victor Banerjee, Atul Kulkarni, Roopa Ganguly, Naved Aslam, Aparajita",Drama,
,,*Meri Padosan*,Prakash Saini,"Sarvar Ahuja, Saadhika Randhawa, Hina Tasleem, Sneha Dhabi, Sanjay Mishra, 
Ashok Bagla, Khayali",Comedy,
,*22*,*Sikandar*,Piyush Jha,"Parzan Dastur, Ayesha Kapur, R. Madhavan, Sanjay Suri",Social,
*MAY*,*6*,*Sanam Teri Kasam*,Lawrence D'Souza,"Saif Ali Khan, Pooja Bhatt, Atul Agnihotri",Comedy Romance,
,,*Team - The Force*,Ajay Chandhok,"Sohail Khan, Amrita Arora, Yash Tonk",Action,
*JUN*,*12*,*Kal Kissne Dekha*,Vivek Sharma,,"Jackky Bhagnani, Vaishali Desai, Rishi Kapoor, Juhi Chawla, Riteish Deshmukh, 
Sanjay Dutt, Dalip Tahil","Romance, Drama, Social, Comedy"
,,*Zor Lagaa Ke...Haiya!*,Girish Girija Joshi,"Mithun Chakraborty, Mahesh Manjrekar, Sachin Khedekar, Raj Zutshi, Ashwin 
Chitale, Gulshan Grover",,
,*19*,*Let's Dance*,Aarif Sheikh,"Ajay Chaudhary, Gayatri Patel",Romance,
,,*Paying Guests*,Paritossh Painter,"Shreyas Talpade, Javed Jaffrey, Aashish Chaudhary, Chunky Pandey, Vatsal 
Sheth, Johnny Lever, Celina Jaitly, Riya Sen, Neha Dhupia",Comedy,
,*26*,*New York*,Kabir Khan,"John Abraham, Katrina Kaif, Neil Mukesh, Irrfan Khan","Action Thriller, Romance",
*JUL*,*3*,*Kambakkht Ishq*,Sabbir Khan,"Akshay Kumar, Kareena Kapoor, Aftab Shivdasani, Amrita Arora, Javed Jaffrey, 
Kirron Kher, Boman Irani","Action, Comedy, Romance",
,*10*,*Sankat City*,Pankaj Advani,"Kay Kay Menon, Anupam Kher, Rimi Sen, Chunky Pandey",Dark Comedy,
,,*Shortkut*,Neeraj Vora,"Akshaye Khanna, Arshad Warsi, Amrita Rao",Comedy,
,*17*,*Jashnn*,Raksha Mistry & Hasnain S Hyderabadwala,"Adhyayan Suman, Anjana Sukhani, Shahana Goswami, Humayun Saeed",Musical,
,*24*,*Luck*,Soham Shah,"Sanjay Dutt, Imran Khan, Shruti Haasan, Mithun Chakraborty, Danny Denzongpa, 
Ravi Kishan, Rati Agnihotri",Action thriller,
,*31*,*Love Aaj Kal*,Imtiaz Ali,"Saif Ali Khan, Deepika Padukone, Rishi Kapoor, Rahul Khanna, Neetu Singh",Romance,
*AUG*,*7*,*Chal Chalein*,Ujjwal Singh,"Mithun Chakraborty, Rati Agnihotri, Shilpa Shukla, Mukesh Khanna",Social,
,*10*,*Teree Sang*,Satish Kaushik,"Ruslaan Mumtaz, Sheena Shahabadi, Neena Gupta",Drama,
,*14*,*Kaminey*,Vishal Bhardwaj,"Shahid Kapoor, Priyanka Chopra, Amole Gupte",Drama,
,,*Life Partner*,Rumi Jaffrey,"Govinda, Fardeen Khan, Tusshar Kapoor, Genelia D'Souza, Prachi Desai, Amrita 
Rao, Anupam Kher","Comedy, Romance",
,*28*,*Daddy Cool*,K. Murli Manohar Rao,"Suniel Shetty, Aftab Shivdasani, Aarti Chabria, Aashish Chaudhary, Javed 
Jaffrey, Rajpal Yadav, Sophie Chaudhry, Tulip Joshi, Chunky Pandey, Prem 
Chopra, Kim Sharma",Comedy,
,,*Kisaan*,Puneet Sira,"Jackie Shroff, Sohail Khan, Arbaaz Khan, Diya Mirza, Nauheed Cyrusi",Social,
,,*Love Khichdi*,Srinivas Bhashyam,"Randeep Hooda, Rituparna Sengupta, Divya Dutta",Comedy,
,,*Quick Gun Murugun*,Shashanka Ghosh,"Rajendra Prasad, Sandhya Mridul, Nassar",Comedy,
,,*Toss*,Ramesh Khatkar,"Prashant Raj Sachdev, Ashmit Patel, Rannvijay Singh",Thriller,
,,*Yeh Mera India*,N. Chandra,"Anupam Kher, Perizaad Zorabian, Purab Kohli, Rajpal Yadav, Sarika, Seema 
Biswas",Social,
*SEP*,*3*,"*Three – Love, Lies and Betrayal*",Vishal Pandya,"Aashish Chaudhary, Akshay Kapoor Nausheen Ali Sardar",Thriller,
,*4*,*Aagey Se Right*,Indrajit Nattoji,"Shreyas Talpade, Shanti Pandit, Mahi Gill, Kay Kay Menon, Shruti Seth, Shenaz 
Treasurywala",Comedy,
,,*Chintu Ji*,Ranjit Kapoor,"Rishi Kapoor, Priyanshu Chatterjee, Kulraj Randhawa",Comedy,
,,*Fox*,Deepak Tijori,"Arjun Rampal, Sagarika Ghatge, Udita Goswami, Sunny Deol, Vipul Gupta",Drama,
,*11*,*Aamras*,Rupali Guha,"Jiya Sarang, Pari Sehgal, Rakhi Chadda, Sanya Balsara, Zarina Wahab, Reema, 
Sukanya Kulkarni, Shubhi, Vikram Kapadia, Usha Bachani, Sonali Sachdev, 
Meher, Sunil Sinha, Manoj Pahwa",Drama,
,,*Baabarr*,Ashu Trikha,"Soham Deepak, Mithun Chakraborty, Urvashi Sharma",Action,
,,*Phir Kabhi*,Pradeep Guha,"Mithun Chakraborty, Dimple Kapadia, Gulshan Grover, Rati Agnihotri",Drama,
,,*Vaada Raha*,Samir Karnik,"Bobby Deol, Kangana Ranaut, Dwij Yadav, Atul Agnihotri",Romance,
,*18*,*Dil Bole Hadippa!*,Anurag Singh,"Shahid Kapoor, Rani Mukerji, Anupam Kher, Dalip Tahil, Rakhi Sawant, Sherlyn 
Chopra","Romantic comedy, Sports",
,,*Wanted*,Prabhu Deva,"Salman Khan, Ayesha Takia, Prakash Raj, Vinod Khanna, Mahesh Manjrekar","Action, Romance",
,,*Blue Oranges*,Rajesh Ganguly,"Rajat Kapoor, Shishir Sharma, Aham Sharma, Puja Kanwal, Rati Agnihotri, 
Harsh Chhaya",Thriller,
,*25*,*What's Your Raashee?*,Ashutosh Gowarikar,"Harman Baweja, Priyanka Chopra",Romantic comedy,
*OCT*,*2*,*Do Knot Disturb*,David Dhawan,"Govinda, Ritesh Deshmukh, Lara Dutta, Sushmita Sen, Sohail Khan, Ranvir 
Shorey, Rajpal Yadav","Comedy, Romance",
,,*Wake Up Sid*,Ayaan Mukherjee,"Ranbir Kapoor, Konkona Sen Sharma, Rahul Khanna, Anupam Kher",Romantic Comedy,
,*9*,*Acid Factory*,Suparn Verma,"Dia Mirza, Fardeen Khan, Irrfan Khan, Manoj Bajpai, Dino Morea, Aftab 
Shivdasani, Danny Denzongpa, Gulshan Grover",Action,
,*16*,*All The Best: Fun Begins*,Rohit Shetty,"Sanjay Dutt, Ajay Devgan, Fardeen Khan, Bipasha Basu, Mugdha Godse",Comedy,
,,*Blue*,Anthony D'souza,"Akshay Kumar, Sanjay Dutt, Lara Dutta, Zayed Khan, Katrina Kaif, Rahul Dev",Action,
,,*Main Aurr Mrs Khanna*,Prem Soni,"Salman Khan, Kareena Kapoor, Sohail Khan, Deepika Padukone, Dino Morea, Preity 
Zinta, Nauheed Cyrusi, Yash Tonk, Bappi Lahiri","Drama, Romance",
,*23*,*Bal Ganesh 2*,Pankaj Sharma,,Animation,
,,*Fruit and Nut*,Kunal Vijaykar,"Boman Irani, Cyrus Broacha, Mahesh Manjrekar, Dia Mirza",Comedy,
,,*Love Ka Tadka*,Gautam Adhikari & Rajan Wagdhare,"Nauheed Cyrusi, Sameer Dattani",Romantic Comedy,
,*30*,*London Dreams*,Vipul Shah,"Salman Khan, Ajay Devgan, Asin Thottumkal, Om Puri","Musical, Social, Drama, Romance",
,,*Aladin*,Sujoy Ghosh,"Amitabh Bachchan, Sanjay Dutt, Jacqueline Fernandez, Ritesh Deshmukh, Sahil 
Khan, Ratna Pathak Shah",Fantasy,
*NOV*,*6*,*Ajab Prem Ki Ghazab Kahani*,Rajkumar Santoshi,"Ranbir Kapoor, Katrina Kaif, Upen Patel","Comedy, Romance",
,,*Jail*,Madhur Bhandarkar,"Neil Nitin Mukesh, Mugdha Godse",Social,
,*13*,*Tum Mile*,Kunal Deshmukh,"Emraan Hashmi, Soha Ali Khan",Romance,
,,*Aao Wish Karein*,Glenn Baretto,"Aftab Shivdasani, Aamna Shariff, Johnny Lever, Ritesh Deshmukh",Fantasy,
,*20*,*Kurbaan*,Rensil D'Silva,"Saif Ali Khan, Kareena Kapoor, Vivek Oberoi, Dia Mirza, Om Puri, Kirron Kher, 
Nauheed Cyrusi","Thriller, Romance",
,,*Shaabash! You Can Do It*,Shankar Mondal,"Hitesh Agrawal, Mansi Dovhal, Sudesh Berry, Nasir Khan","Comedy, Thriller, Social",
,,*Marega Salaa*,Devang Dholkia,"Jimmy Shergill, Kim Sharma, Hrishita Bhatt, Rahul Handa",Action,
,*27*,*De Dana Dan'*,Priyadarshan,"Akshay Kumar, Katrina Kaif, Sunil Shetty, Paresh Rawal, Neha Dhupia, Sameera 
Reddy",Comedy,
*DEC*,*3*,*Radio*,Ishaan Trivedi,"Himesh Reshammiya, Shenaz Treasurywala, Sonal Sehgal",Musical,
,*4*,*Paa*,R. Balki,"Amitabh Bachchan, Abhishek Bachchan, Vidya Balan, Paresh Rawal","Drama, Family",
,*11*,*Rocket Singh: Salesman of the Year*,Shimit Amin,"Ranbir Kapoor, Shazahn Padamsee, Sharon Prabhakar",Comedy,
,*18*,*Raat Gayi Baat Gayi?*,Saurabh Shukla,"Rajat Kapoor, Vinay Pathak, Neha Dhupia, Navneet Nishan, Dalip Tahil, Anuradha 
Menon, Aamir Bashir, Iravati Harshe",Drama,
,*25*,*3 Idiots*,Rajkumar Hirani,"Aamir Khan, Kareena Kapoor, Sharman Joshi, R. Madhavan, Boman Irani, Omi 
Vaidya",Comedy,
,*31*,*Accident on Hill Road*,Mahesh Nair,"Celina Jaitley, Farooq Sheikh",Thriller,
